{
  "$schema": "../_template/Config.schema.json",
  "frequenciesGHz": [
    9.8
  ],
  "randomSeed": null,
  "aspectAngle": {
    "thetaDeg": [
      -90,
      90,
      0.1
    ],
    "theta0sDeg": [
      0
    ]
  },
  "position": {
    "source": "uniform",
    "Ne": 32,
    "dmin": 15.5,
    "Unit": "mm"
  },
  "amplitude": {
    "source": "optimize",
    "bounds": [
      0.1,
      1
    ],
    "optimizeHalf": true,
    "step": null,
    "inDB": false
  },
  "phase": {
    "source": "default"
  },
  "target": {
    "components": {
      "sidelobe": {
        "weight": 1.0,
        "targetDb": -30
      },
      "main_lobe_pointing": {"weight": 10}
    }
  },
  "ePattern": {
    "enabled": true,
    "csvDirectory": "E:\\Projects\\Opencode\\beamforming2\\input\\element_pattern\\kty\\phi0",
    "thetaDeg": [
      -90,
      90
    ],
    "isGain": true,
    "inDB": true,
    "aepMode": false
  },
  "optimizer": {
    "method": "cma",
    "sigma": 0.5,
    "pop_size": 100,
    "max_iter": 1000,
    "n_jobs": -1,
    "verbose": true,
    "importInitIndividual": [false, ""]
  }
}